{
  "image_sha256": "23efe5ca9ebd8a10a6d4bebe4afcdcfdad183eb6ce097879f3e6c1c96a09ce4e",
  "model": "synthetic-perfect-reader",
  "recorded_at": "2026-10-28T00:00:00Z",
  "read": {
    "app": "demo_pepper",
    "screen_type": "driver_assigned",
    "options": [],
    "fee_text": null,
    "driver_eta_min": 4,
    "driver_distance_text": "0.5 km"
  },
  "usage": {
    "input_tokens": 0,
    "cached_input_tokens": 0,
    "output_tokens": 0
  },
  "cost_usd": 0.0,
  "expect": {
    "driver_eta": "SEE_IN_APP",
    "driver_distance": "VERIFIED",
    "rule": "f"
  },
  "variant": "driver_eta_off"
}
