{
  "image_sha256": "63d3306c5057dc99706c96dde86c7e939f05a4deb1564f98c1381c9c284c854a",
  "model": "synthetic-perfect-reader",
  "recorded_at": "2026-10-28T00:00:00Z",
  "read": {
    "app": "demo_tamarind",
    "screen_type": "fare_options",
    "options": [
      {
        "vehicle_class": "bike",
        "label_text": "Moto",
        "price_min": 105,
        "price_max": 105,
        "price_struck_text": null,
        "eta_min": 3,
        "bbox_0_1000": [
          30,
          442,
          970,
          518
        ]
      },
      {
        "vehicle_class": "auto",
        "label_text": "Auto",
        "price_min": 176,
        "price_max": 176,
        "price_struck_text": "₹205",
        "eta_min": 5,
        "bbox_0_1000": [
          30,
          521,
          970,
          597
        ]
      },
      {
        "vehicle_class": "cab_economy",
        "label_text": "Tamarind Cab",
        "price_min": 272,
        "price_max": 272,
        "price_struck_text": null,
        "eta_min": 4,
        "bbox_0_1000": [
          30,
          600,
          970,
          676
        ]
      },
      {
        "vehicle_class": "cab_xl",
        "label_text": "Tamarind XL",
        "price_min": 1040,
        "price_max": 1040,
        "price_struck_text": null,
        "eta_min": 8,
        "bbox_0_1000": [
          30,
          679,
          970,
          755
        ]
      }
    ],
    "fee_text": null,
    "driver_eta_min": null,
    "driver_distance_text": null
  },
  "usage": {
    "input_tokens": 0,
    "cached_input_tokens": 0,
    "output_tokens": 0
  },
  "cost_usd": 0.0,
  "expect": {
    "rows": [
      "UNREADABLE",
      "VERIFIED",
      "VERIFIED",
      "VERIFIED"
    ],
    "reason": "price_digits_mismatch",
    "rule": "b"
  },
  "variant": "one_digit_off"
}
