{
  "image_sha256": "d4b13df48fdf47360c3e208e6681e0e62c4900d04cfa7c7310e93d0116ebdef4",
  "model": "synthetic-perfect-reader",
  "recorded_at": "2026-10-28T00:00:00Z",
  "read": {
    "app": "demo_kestrel",
    "screen_type": "cancelled",
    "options": [],
    "fee_text": null,
    "driver_eta_min": null,
    "driver_distance_text": null
  },
  "usage": {
    "input_tokens": 0,
    "cached_input_tokens": 0,
    "output_tokens": 0
  },
  "cost_usd": 0.0,
  "expect": {
    "rows": []
  }
}
