{
  "image_sha256": "aebe95d8df30f936666733b4ae737b44ee4931e91aeacda641eae2f90faa8594",
  "model": "meta-models/Muse-Spark-Open-816B-A42B",
  "recorded_at": "2026-10-28T16:47:44Z",
  "read": {
    "app": "demo_kestrel",
    "screen_type": "searching",
    "options": [],
    "fee_text": null,
    "driver_eta_min": null,
    "driver_distance_text": null
  },
  "usage": null,
  "cost_usd": 0.005581,
  "source": "live",
  "request_id": "eval-run:793f4c6948e04a55:002c6ff739fc45f3b35cd9b8863d2ed9",
  "latency_ms": 47943
}
