{
  "image_sha256": "23efe5ca9ebd8a10a6d4bebe4afcdcfdad183eb6ce097879f3e6c1c96a09ce4e",
  "model": "meta-models/Muse-Spark-Open-816B-A42B",
  "recorded_at": "2026-10-28T17:09:42Z",
  "read": {
    "app": "demo_pepper",
    "screen_type": "driver_assigned",
    "options": [],
    "fee_text": null,
    "driver_eta_min": 3,
    "driver_distance_text": null
  },
  "usage": null,
  "cost_usd": 0.006448,
  "source": "live",
  "request_id": "eval-run:793f4c6948e04a55:9c99fd657e674216b5351fb4b88ac277",
  "latency_ms": 55241
}
