{
  "image_sha256": "467d6211aa2f882c95aa994d01e19831187700ea5e2d0ffda3ba882c82f7c33b",
  "model": "meta-models/Muse-Spark-Open-816B-A42B",
  "recorded_at": "2026-10-28T16:58:03Z",
  "read": {
    "app": "demo_pepper",
    "screen_type": "cancel_flow",
    "options": [],
    "fee_text": "Cancellation fee up to ₹50 may apply",
    "driver_eta_min": null,
    "driver_distance_text": null
  },
  "usage": null,
  "cost_usd": 0.005568,
  "source": "live",
  "request_id": "eval-run:793f4c6948e04a55:063366f2e14f414e8a060d8b6dbc2459",
  "latency_ms": 54149
}
